"Title","Description","RDataPath","BiocVersion","Genome","SourceType","SourceUrl","SourceVersion","Species","TaxonomyId","Coordinate_1_based","DataProvider","Maintainer","RDataClass","DispatchClass"
"Rediportal RNA editing sites, all data, (mm10)","GRanges object containing 107,094 mouse RNA editing sites, mm10, additional columns describe editing site characteristics, as described by REDIPORTAL http://srv00.recas.ba.infn.it/atlas/help.html","raerdata/1.0.0/rediportal_full_mm10.rda","3.18","mm10","RDA","http://srv00.recas.ba.infn.it/atlas/","1","Mus musculus","10090",TRUE,"REDIportal","Kent Riemondy <kent.riemondy@cuanschutz.com>","GRanges","Rda"
"Rediportal RNA editing sites, coordinates only, (mm10)","GRanges object containing 107,094 mouse RNA editing sites","raerdata/1.0.0/rediportal_coords_mm10.rda","3.18","mm10","RDA","http://srv00.recas.ba.infn.it/atlas/","1","Mus musculus","10090",TRUE,"REDIportal","Kent Riemondy <kent.riemondy@cuanschutz.com>","GRanges","Rda"
"Rediportal RNA editing sites, all data, (hg38)","GRanges object containing 15,638,648 human RNA editing sites, hg38, additional columns describe editing site characteristics, as described by REDIPORTAL http://srv00.recas.ba.infn.it/atlas/help.html","raerdata/1.0.0/rediportal_full_hg38.rda","3.18","hg38","RDA","http://srv00.recas.ba.infn.it/atlas/","1","Homo sapiens","9606",TRUE,"REDIportal","Kent Riemondy <kent.riemondy@cuanschutz.com>","GRanges","Rda"
"Rediportal RNA editing sites, coordinates only, (hg38)","GRanges object containing 15,638,648 human RNA editing sites, hg38","raerdata/1.0.0/rediportal_coords_hg38.rda","3.18","hg38","RDA","http://srv00.recas.ba.infn.it/atlas/","1","Homo sapiens","9606",TRUE,"REDIportal","Kent Riemondy <kent.riemondy@cuanschutz.com>","GRanges","Rda"
"Mouse adenosine-to-inosine RNA recoding sites","GRanges object containing 1,160 mouse CDS recoding RNA editing sites, mm10","raerdata/1.0.0/gabay_sites_mm10.rds","3.18","mm10","RDA","https://static-content.springer.com/esm/art%3A10.1038%2Fs41467-022-28841-4/MediaObjects/41467_2022_28841_MOESM3_ESM.xlsx","1","Mus musculus","10090",TRUE,"https://doi.org/10.1038/s41467-022-28841-4","Kent Riemondy <kent.riemondy@cuanschutz.com>","GRanges","Rda"
"Human adenosine-to-inosine RNA recoding sites","GRanges object containing 1,517 human CDS recoding RNA editing sites, hg38","raerdata/1.0.0/gabay_sites_hg38.rds","3.18","hg38","RDA","https://static-content.springer.com/esm/art%3A10.1038%2Fs41467-022-28841-4/MediaObjects/41467_2022_28841_MOESM3_ESM.xlsx","1","Homo sapiens","9606",TRUE,"https://doi.org/10.1038/s41467-022-28841-4","Kent Riemondy <kent.riemondy@cuanschutz.com>","GRanges","Rda"
